,name,id,description,picture,servings,calories,reviews,rating,carbohydrates,sugars,fat,saturated fat,cholesterol,calcium,iron,magnesium,potassium,sodium,ingredients,dietary fiber
87,Puerto Rican Meat Patties,14589,"These little parcels are made with seasoned ground meat sealed in egg roll wrappers; they are then deep fried. Serve with salsa and guacamole if desired, but plain they are a dream. This recipe was handed down from my grandfather to my mom, from her to me, and now I'm passing it on to you. ",https://imagesvc.meredithcorp.io/v3/mm/image?url=https%3A%2F%2Fimages.media-allrecipes.com%2Fuserphotos%2F2681619.jpg,8,522.2,61,4.4,36.7,2.1,34.7,6.3,0.0395,0.047700000000000006,0.0034,0.0289,0.3525,0.5051,"3 tablespoons olive oil #1 pound ground beef #1 ½ cups chopped fresh cilantro #1 onion, chopped #4 cloves garlic, minced #1 green bell pepper, chopped #1 (8 ounce) can tomato sauce #1 (16 ounce) package egg roll wrappers #2 quarts vegetable oil for frying ",2.2
88,Chicken Fried Steak I,14590,Breaded and deep fried beef cutlets are known as chicken fried steak because of the similarity in cooking method to fried chicken. This is a family recipe that we have used for years. Vegetable oil may be used in place of shortening for frying. ,https://imagesvc.meredithcorp.io/v3/mm/image?url=https%3A%2F%2Fimages.media-allrecipes.com%2Fuserphotos%2F1214322.jpg,4,616.6,134,4.1,44.4,14.6,25.9,9.8,0.13419999999999999,0.393,0.004200000000000001,0.071,0.9226,0.2496,"1 pound boneless beef top loin #2 cups shortening #1 egg, beaten #1 cup buttermilk # salt and pepper to taste #¼ teaspoon garlic powder #1 cup all-purpose flour #¼ cup all-purpose flour #1 quart milk # salt and pepper to taste ",1.1
89,The Best Marinade Around,14591,"This recipe makes enough marinade for one steak, but can be multiplied for the amount you are grilling. ",https://imagesvc.meredithcorp.io/v3/mm/image?url=https%3A%2F%2Fimages.media-allrecipes.com%2Fuserphotos%2F800834.jpg,1,571.3,133,4.5,22.3,2.2,54.4,7.5,0.0,0.09620000000000001,0.0036,0.0688,0.44689999999999996,7.2202,"½ cup soy sauce #¼ cup olive oil #1 lemon, juiced #1 clove garlic, crushed ",6.2
90,Italian Style Meatloaf I,14592,"Made with mozzarella cheese and Italian seasoning, this is a different twist on everyday meatloaf! Enjoy! ",https://imagesvc.meredithcorp.io/v3/mm/image?url=https%3A%2F%2Fpublic-assets-ucg.meredithcorp.io%2F188f639c42fc01d8e8baeaac04595c80%2F6722028.jpg,6,538.5,528,4.5,15.6,5.2,38.9,16.6,0.18059999999999998,0.1991,0.0038,0.0361,0.385,0.9412999999999999,"1 ½ pounds ground beef #2 eggs, beaten #¾ cup dry bread crumbs #¼ cup ketchup #1 teaspoon Italian-style seasoning #1 teaspoon dried oregano #1 teaspoon dried basil #1 teaspoon garlic salt #1 (14.5 ounce) can diced tomatoes, drained #1 ½ cups shredded mozzarella cheese ",1.4
91,Grandma Flo's Shipwreck,14593,"You can't go wrong with meat and potatoes, and this recipe combines them in one dish. The recipe was given to my husband by a friend at work who brought it for lunch often. I usually double it for my family; my husband works in a giant tire factory, and has an appetite to match. The smell makes it hard to wait for it to finish baking. ",0,4,667.9,61,3.8,66.1,8.1,31.9,12.5,0.0965,0.08259999999999999,0.0062,0.0747,1.3576,1.3211,"4 potatoes, peeled and sliced #1 pound ground beef #1 teaspoon salt #¼ teaspoon ground black pepper #1 onion, thinly sliced #1 (15 ounce) can kidney beans, drained #1 (10.75 ounce) can condensed tomato soup ",12.0
92,Glazed Corned Beef with Lentils,14594,"First the brisket is simmered for several hours, and then it is baked with a honey mustard glaze. While the brisket is baking, make the lentils using the boiling liquid from the brisket. Making the lentils is optional with this recipe, but I do strongly recommend them. Try this with good beer and rye bread. ",https://imagesvc.meredithcorp.io/v3/mm/image?url=https%3A%2F%2Fimages.media-allrecipes.com%2Fuserphotos%2F6689391.jpg,8,651.9,43,4.6,50.0,17.7,30.9,10.2,0.15680000000000002,0.0645,0.006900000000000001,0.0851,0.7981,1.9787000000000001,2 quarts water #4 pounds corned beef brisket #1 large onion #1 large carrot #1 stalk celery #2 cloves garlic #1 tablespoon pickling spice #¼ cup packed brown sugar #½ teaspoon ground ginger #3 tablespoons Dijon-style prepared mustard #¼ cup honey #¼ cup red chile sauce (Optional)#2 cups dry lentils (Optional)#1 tablespoon chopped fresh parsley ,15.3
93,Salisbury Steak,14595,"This recipe has been in my family for years. It's easy to cook, but tastes like it took hours to make! I usually make enough extra sauce to pour over mashed potatoes. YUM! ",https://imagesvc.meredithcorp.io/v3/mm/image?url=https%3A%2F%2Fimages.media-allrecipes.com%2Fuserphotos%2F9445046.jpg,6,440.4,3498,4.4,14.1,4.3,32.3,12.7,0.1275,0.048100000000000004,0.0031,0.0277,0.3805,0.8182999999999999,1 (10.5 ounce) can condensed French onion soup #1 ½ pounds ground beef #½ cup dry bread crumbs #1 egg #¼ teaspoon salt #⅛ teaspoon ground black pepper #1 tablespoon all-purpose flour #¼ cup ketchup #¼ cup water #1 tablespoon Worcestershire sauce #½ teaspoon mustard powder ,0.9
94,Belgian Beef Stew,14596,"This is a wonderful, dark, beef stew that is great over noodles. ",https://imagesvc.meredithcorp.io/v3/mm/image?url=https%3A%2F%2Fimages.media-allrecipes.com%2Fuserphotos%2F7214884.jpg,7,439.1,23,3.8,25.8,8.6,24.1,9.4,0.0869,0.07640000000000001,0.0031,0.0437,0.6031,1.2199,"1 pound bacon, diced #1 tablespoon butter #20 small boiling onions, peeled #3 cloves garlic, minced #2 pounds lean beef chuck, trimmed and cut into 1 inch cubes #2 tablespoons all-purpose flour #2 teaspoons salt #½ teaspoon ground black pepper #16 ounces dark beer #½ bunch fresh parsley, chopped #1 lemon, juiced and zested #1 tablespoon grated lemon zest ",4.5
95,Slovak Stuffed Cabbage,14597,I received this recipe from my grandmother. It was passed down to her from her grandmother. This can be made ahead of time and frozen for a few days prior to cooking. Enjoy! ,https://imagesvc.meredithcorp.io/v3/mm/image?url=https%3A%2F%2Fimages.media-allrecipes.com%2Fuserphotos%2F1102439.jpg,8,556,211,4.7,31.6,16.7,36.5,13.5,0.101,0.1015,0.0053,0.0598,0.8761,2.0957,"1 pound ground beef #1 pound ground pork #1 onion, chopped #1 teaspoon salt # black pepper to taste #1 teaspoon chopped fresh parsley #½ cup cooked brown rice #1 ¼ teaspoons garlic salt #2 (10.75 ounce) cans condensed tomato soup #27 ounces sauerkraut, drained #1 (29 ounce) can diced tomatoes #1 medium head cabbage #5 slices bacon #2 tablespoons white sugar #3 cups water ",6.9
96,Yuck-a-Muck,14598,"This is very quick and easy dish. My brother was starving one night, so I just started throwing things in a skillet! He gave it the name and it sure is good. This is just the basic recipe, and then with additions of seasonings you can have almost any style (Italian, Mexican, etc) meal you want! Our favorite is Cowboy style, with just a little Worcestershire sauce. ",https://imagesvc.meredithcorp.io/v3/mm/image?url=https%3A%2F%2Fimages.media-allrecipes.com%2Fuserphotos%2F4918698.jpg,5,508.8,13,3.5,47.1,7.6,25.1,10.0,0.0772,0.0573,0.0054,0.0445,0.6434,1.181,"1 pound ground beef #1 onion, chopped #1 green bell pepper, chopped #1 clove garlic, minced #1 (16 ounce) can diced tomatoes #1 (15 ounce) can ranch-style beans #1 (15 ounce) can whole kernel corn, drained #1 (15 ounce) can sliced potatoes, drained #2 tablespoons Worcestershire sauce ",9.5
97,Cube Steak Stew,14599,"A fast and easy stew for those cold nights when you want comfort food, but don't want to spend a lot of time cooking. It's an old favorite in our family recipe box. ",https://imagesvc.meredithcorp.io/v3/mm/image?url=https%3A%2F%2Fimages.media-allrecipes.com%2Fuserphotos%2F1402.jpg,4,464.8,43,4.1,26.8,3.2,21.2,7.7,0.1076,0.0363,0.0058,0.0601,0.906,1.2747,"1 ½ pounds beef cube steak #3 tablespoons all-purpose flour #1 tablespoon olive oil #½ tablespoon butter #1 onion, chopped #1 clove garlic, minced #1 cube beef bouillon, dissolved in 1 cup water #1 (15 ounce) can sliced potatoes, drained #1 (8 ounce) can peas and carrots #1 teaspoon browning sauce #½ teaspoon Italian seasoning #1 teaspoon salt #1 teaspoon ground black pepper ",4.6
