,name,id,description,picture,servings,calories,reviews,rating,carbohydrates,dietary fiber,sugars,fat,saturated fat,cholesterol,calcium,iron,magnesium,potassium,sodium,ingredients
0,Herbed Cream Cheese Omelet,14100,"Somehow, when cream cheese is mixed with herbs and melted in an omelet, it acquires a wonderful taste that you wouldn't associate with cream cheese. ",https://imagesvc.meredithcorp.io/v3/mm/image?url=https%3A%2F%2Fimages.media-allrecipes.com%2Fuserphotos%2F204247.jpg,4,319.6,46,4.1,1.7,0.2,0.9,28.5,14.8,0.42610000000000003,0.08209999999999999,0.0023,0.0154,0.2003,0.2879,"4 ounces cream cheese, softened #½ cup fresh cilantro leaves # salt and pepper to taste #3 tablespoons butter #8 eggs "
1,Easy Roasted Peppers,14101,"This is a really basic way to roast peppers for use in any recipe. Choose any color peppers you like, or use a variety of colors for a beautiful presentation. After they are roasted you can add an oil and balsamic dressing, or fry in olive oil and garlic to serve with crusty bread. ",https://imagesvc.meredithcorp.io/v3/mm/image?url=https%3A%2F%2Fimages.media-allrecipes.com%2Fuserphotos%2F4182191.jpg,4,55.3,61,4.6,10.8,3.6,7.2,0.5,0.0,0.0,0.0125,0.0008,0.0214,0.37660000000000005,0.0070999999999999995,6 red bell peppers 
2,Egg in a Boat,14102,"Over-easy eggs, and toast all in one! I like to use the hole cut out of the center for dipping into the egg yolk! ",https://imagesvc.meredithcorp.io/v3/mm/image?url=https%3A%2F%2Fimages.media-allrecipes.com%2Fuserphotos%2F9169705.jpg,1,188.9,259,4.7,13.0,0.6,1.5,11.6,5.4,0.2013,0.066,0.0019,0.0119,0.0937,0.2811,½ tablespoon butter #1 slice white bread #1 egg 
3,Potato Bread Rolls,14103,"A delicious way to use leftover mashed potatoes The recipe can be doubled, halved, or varied in other ways to suit the quantity of leftovers or your personal preference. These can be served with ketchup or any other dipping sauce. ",https://imagesvc.meredithcorp.io/v3/mm/image?url=https%3A%2F%2Fimages.media-allrecipes.com%2Fuserphotos%2F4068744.jpg,4,236.8,4,4.3,23.0,1.7,2.3,14.9,2.1,0.001,0.0541,0.0012,0.017,0.2065,0.3315,4 tablespoons vegetable oil #¼ cup chopped onion #¼ teaspoon ground turmeric #¼ teaspoon chili powder #1 cup mashed potatoes #1 tablespoon chopped fresh cilantro #2 tablespoons water #4 slices white bread 
4,Tofu Veggie Salad,14104,"This is an odd combination of ingredients, but ends up being a cool, refreshing, and healthy salad. I learned the recipe from my sister, who never used measurements, so measure according to your taste, and use whatever veggies you like. ",0,8,146.5,3,2.6,13.6,4.6,2.8,5.9,0.9,0.0,0.427,0.0028,0.0551,0.3856,0.5237,"1 pound firm tofu, crumbled #2 carrots, grated #1 cucumber, cleaned and diced #6 green onions, chopped #2 cups fresh peas #1 (2 ounce) can chopped black olives #¼ cup teriyaki sauce #2 tablespoons Dijon-style prepared mustard "
5,Green Beans with Bread Crumbs,14105,My mom gave me this recipe. It's been in the family for years. Hope you enjoy it as much as we do - it's a sure way to get my kids to eat green beans. You can easily double this recipe. ,https://imagesvc.meredithcorp.io/v3/mm/image?url=https%3A%2F%2Fimages.media-allrecipes.com%2Fuserphotos%2F3806530.jpg,4,210,381,4.3,13.6,4.2,1.9,15.8,3.0,0.0055,0.12490000000000001,0.0018,0.0315,0.2516,0.2102,"1 pound fresh green beans, washed and trimmed #½ cup water #¼ cup Italian-style seasoned bread crumbs #¼ cup olive oil # salt and pepper to taste #¼ teaspoon garlic powder #¼ teaspoon dried oregano #¼ teaspoon dried basil #¼ cup grated Parmesan cheese "
6,Fluffy Potato Casserole,14106,This is a very tasty potato dish. ,https://imagesvc.meredithcorp.io/v3/mm/image?url=https%3A%2F%2Fimages.media-allrecipes.com%2Fuserphotos%2F630234.jpg,2,943.2,91,4.4,66.4,4.2,6.1,66.3,32.7,0.31339999999999996,0.1805,0.0032,0.0571,0.9123,1.6887,"2 cups mashed potatoes #1 (8 ounce) package cream cheese, softened #1 onion, chopped #2 eggs, beaten #1 tablespoon all-purpose flour #¼ teaspoon salt #⅛ teaspoon ground black pepper #½ (6 ounce) can French fried onions "
7,Kentucky Bourbon Sweet Potatoes,14107,"This recipe was been in the family for years, I don't know where it came from. The only thing I changed was amount of bourbon. If you prefer to use canned sweet potatoes, it takes three (18 ounce) cans. ",https://imagesvc.meredithcorp.io/v3/mm/image?url=https%3A%2F%2Fimages.media-allrecipes.com%2Fuserphotos%2F922498.jpg,8,528.9,67,4.3,93.6,10.2,39.3,11.7,7.3,0.0305,0.10579999999999999,0.0021000000000000003,0.0854,1.1521,0.2692,"6 large sweet potatoes, peeled and sliced #1 cup white sugar #½ cup butter #½ cup bourbon #½ teaspoon vanilla extract "
8,Moroccan Lentil Salad,14108,"A quick, colorful and spicy protein-rich salad or side dish ",https://imagesvc.meredithcorp.io/v3/mm/image?url=https%3A%2F%2Fimages.media-allrecipes.com%2Fuserphotos%2F116841.jpg,5,190.4,71,4.4,27.6,9.8,5.1,6.3,0.9,0.0,0.048600000000000004,0.0028,0.052700000000000004,0.5993999999999999,0.094,"½ cup dry lentils #1 ½ cups water #½ (15 ounce) can garbanzo beans, drained #2 tomatoes, chopped #4 green onions, chopped #2 minced hot green chile peppers #1 green bell pepper, chopped #½ yellow bell pepper, chopped #1 red bell pepper, chopped #1 lime, juiced #2 tablespoons olive oil #¼ cup chopped fresh cilantro # salt to taste "
9,Indian Cauliflower,14109,A spicy cauliflower served whole on a platter - looks like a red and yellow flower. Garam Masala can be found in Indian grocery stores and some traditional grocery stores. I like to serve peas and carrots lightly cooked in butter on the side of this dish. ,https://imagesvc.meredithcorp.io/v3/mm/image?url=https%3A%2F%2Fimages.media-allrecipes.com%2Fuserphotos%2F4515420.jpg,5,167.9,70,4.1,15.1,6.2,7.1,11.6,1.6,0.0,0.0638,0.0013,0.0399,0.7476,0.0621,"1 large head cauliflower #4 tablespoons vegetable oil #½ teaspoon ground turmeric #1 small onion, minced #2 tomatoes, pureed #1 teaspoon garlic powder #3 teaspoons garam masala (Optional)# salt to taste #½ head lettuce "
10,Ken's Minestrone Soup,14110,"My husband and I love the minestrone soup at restaurants, so he came home and started experimenting. This is the delicious soup that he came up with. ",https://imagesvc.meredithcorp.io/v3/mm/image?url=https%3A%2F%2Fimages.media-allrecipes.com%2Fuserphotos%2F7632423.jpg,7,225,69,4.5,37.1,10.1,9.8,4.4,0.6,0.0,0.13369999999999999,0.0040999999999999995,0.039299999999999995,0.4213,0.7927000000000001,"2 tablespoons olive oil #1 tablespoon minced garlic #1 onion, thinly sliced #2 large carrots, diced #1 (29 ounce) can Italian-style stewed tomatoes #1 (15 ounce) can cannellini beans #1 (15 ounce) can kidney beans #1 (15 ounce) can green beans, drained #1 small zucchini, sliced #¼ teaspoon dried parsley #1 pinch dried basil #1 pinch dried oregano #1 pinch Italian seasoning #2 bay leaves #2 tablespoons vegetarian chicken flavor seasoning #1 pinch cayenne pepper "
11,Cauliflower and White Cheddar Cheese Soup,14111,"A creamy cauliflower and cheddar soup. Instead of the cauliflower you can also use broccoli, corn kernels or even pumpkin. ",https://imagesvc.meredithcorp.io/v3/mm/image?url=https%3A%2F%2Fimages.media-allrecipes.com%2Fuserphotos%2F2825130.jpg,5,410.6,31,4.1,25.6,3.9,16.2,22.0,14.1,0.0691,0.6427999999999999,0.0008,0.054,1.0455999999999999,1.4175,"2 small heads cauliflower # salt to taste #2 tablespoons unsalted butter #1 onion, chopped #1 clove garlic, minced #4 cups vegetable broth #1 pinch ground nutmeg #1 ½ cups milk #2 cups shredded white Cheddar cheese # freshly ground black pepper "
12,Scalloped Potatoes I,14112,This recipe is so easy and quick. And quite tasty too! ,https://imagesvc.meredithcorp.io/v3/mm/image?url=https%3A%2F%2Fimages.media-allrecipes.com%2Fuserphotos%2F145810.jpg,6,293.2,198,4.3,48.4,6.0,3.0,7.4,4.7,0.0214,0.156,0.0023,0.0621,1.1244,0.44730000000000003,"1 (10.75 ounce) can condensed Cheddar cheese soup #½ cup chopped onion # freshly ground black pepper #4 large baking potatoes, scrubbed #½ cup shredded Cheddar cheese "
13,Tofu Turkey I,14113,A vegan alternative especially good for Thanksgiving dinner! Serve with a vegetarian gravy and all the fixings. Enjoy! ,https://imagesvc.meredithcorp.io/v3/mm/image?url=https%3A%2F%2Fimages.media-allrecipes.com%2Fuserphotos%2F6178276.jpg,10,469.5,54,4.2,22.4,2.8,5.2,32.4,4.3,0.0,0.4363,0.005900000000000001,0.1335,0.4914,1.2949000000000002,"5 (16 ounce) packages extra-firm tofu #2 tablespoons sesame oil #1 red onion, finely diced #1 ⅓ cups diced celery #1 cup chopped mushrooms #2 cloves garlic, minced #⅛ cup dried sage #2 teaspoons dried thyme # salt and pepper to taste #1 ½ teaspoons dried rosemary #¼ cup tamari #3 cups prepared herb stuffing #½ cup sesame oil #¼ cup tamari #2 tablespoons miso paste #5 tablespoons orange juice #1 teaspoon honey mustard #½ teaspoon orange zest #3 sprigs fresh rosemary "
14,Haystacks,14114,"This is a simple one dish meal that's been in my family for years - corn chips, vegetables, beans and cheese all piled up to make a delicious haystack! Kids love it! ",https://imagesvc.meredithcorp.io/v3/mm/image?url=https%3A%2F%2Fimages.media-allrecipes.com%2Fuserphotos%2F573493.jpg,6,634.3,41,4.6,74.7,14.7,7.4,32.2,9.2,0.0282,0.3963,0.0058,0.1379,0.749,1.6978,"2 cups kidney beans, cooked #1 teaspoon salt #2 tablespoons chili powder #1 teaspoon ground black pepper #1 (14.5 ounce) package corn tortilla chips #1 head iceberg lettuce - rinsed, dried, and shredded #2 large tomatoes, chopped #1 green bell pepper, chopped #1 onion, chopped #1 (10 ounce) can chopped black olives #1 carrot, shredded #1 cup shredded Cheddar cheese #½ cup sour cream #1 cup salsa "
15,Homemade Hashbrowns,14115,This recipe is a really nice way to use up leftover mashed potatoes. If you like you could fry the hashbrowns up and then freeze them in airtight bags. You can pop them in the toaster to reheat them! An easy breakfast! ,https://imagesvc.meredithcorp.io/v3/mm/image?url=https%3A%2F%2Fimages.media-allrecipes.com%2Fuserphotos%2F1066409.jpg,4,176,47,3.6,21.2,2.1,2.8,8.6,1.6,0.048600000000000004,0.039,0.0006,0.023399999999999997,0.37160000000000004,0.6266,"2 cups mashed potatoes #1 egg, beaten #1 onion, finely diced #½ teaspoon salt #¼ teaspoon ground black pepper #2 tablespoons olive oil "
16,Katy's Scalloped Corn,14116,"This simple recipe came about by necessity. I needed a dish to take to a church supper, didn't have a car available, so I used things I always have on hand. The Big PLUS: This dish can be baked and 'held' awhile before serving!! Very moist and Delicious!! ",https://imagesvc.meredithcorp.io/v3/mm/image?url=https%3A%2F%2Fimages.media-allrecipes.com%2Fuserphotos%2F895609.jpg,6,261.2,15,3.9,30.8,3.1,6.1,14.3,5.6,0.0511,0.0928,0.0013,0.0312,0.3044,0.5447000000000001,"1 onion, chopped #1 green bell pepper, chopped #2 stalks celery, sliced #2 tablespoons butter #2 tablespoons vegetable oil #1 (14.75 ounce) can creamed corn #1 (15 ounce) can whole kernel corn, drained #1 egg, lightly beaten #½ cup shredded Cheddar cheese #⅓ cup crushed buttery round crackers "
17,Fancy Potatoes,14117,Whipped potatoes with cheeses! Delicious! ,https://imagesvc.meredithcorp.io/v3/mm/image?url=https%3A%2F%2Fimages.media-allrecipes.com%2Fuserphotos%2F3359300.jpg,6,731.3,121,4.5,57.8,6.8,2.8,46.8,29.4,0.1385,0.4128,0.0036,0.09,1.4758,0.5486,5 large potatoes #1 cup sour cream #2 (8 ounce) packages cream cheese #1 pinch garlic salt #2 cups shredded Cheddar cheese 
18,Minestrone Soup,14118,"This soup is very filling and healthy. If possible use fresh vegetables and herbs from the garden. If you like, you can replace the kidney beans with cannelini beans. ",https://imagesvc.meredithcorp.io/v3/mm/image?url=https%3A%2F%2Fimages.media-allrecipes.com%2Fuserphotos%2F449163.jpg,9,399.1,82,4.1,80.9,17.8,13.4,2.4,0.4,0.0,0.1646,0.0074,0.1347,1.4578,0.38180000000000003,"4 cups vegetable stock #2 (14.5 ounce) cans stewed tomatoes #1 large potato, cubed #1 onion, chopped #2 stalks celery, chopped #2 carrots, chopped #1 large head cabbage, finely chopped #2 tablespoons Italian seasoning #1 (15 ounce) can kidney beans #3 cups fresh corn kernels #1 large zucchini, sliced #1 cup uncooked orzo pasta # salt and pepper to taste "
19,Potato Cake,14119,Potato cakes are great for breakfast. Mashed potato cakes with a cheese surprise in the middle. ,https://imagesvc.meredithcorp.io/v3/mm/image?url=https%3A%2F%2Fimages.media-allrecipes.com%2Fuserphotos%2F4551174.jpg,2,602.7,163,4.4,61.6,4.0,3.7,28.5,16.9,0.1718,0.4777,0.0029,0.0638,0.7507,1.2263,"2 cups mashed potatoes #1 egg, beaten #½ cup all-purpose flour # salt to taste #1 pinch garlic salt #1 tablespoon butter #1 cup shredded Cheddar cheese "
20,Scalloped Potatoes II,14120,"Potatoes layered with butter, milk and seasonings. ",https://imagesvc.meredithcorp.io/v3/mm/image?url=https%3A%2F%2Fimages.media-allrecipes.com%2Fuserphotos%2F7961725.jpg,8,312.6,489,4.6,42.0,4.0,6.9,12.8,7.8,0.0351,0.16219999999999998,0.0018,0.0535,0.9032,0.1205,"3 pounds potatoes, thinly sliced # salt and pepper to taste #9 tablespoons all-purpose flour, divided #6 tablespoons butter, diced #1 quart whole milk, or as needed "
21,Chaat - Dahi Batata Puri,14121,"Chaat is a broad term that encompasses many different dishes. This recipe is made of yogurt and potatoes and other chaat sauces. You may need to make a trip to an Indian grocery store to stock up on spherical 'puris' (also called as pani-puri puris), 'sev', green chutney, and a sweet and sour chutney. I have tried here to give as many substitutions as possible, if you are unable to go to an Indian grocery store. However, you will definitely lose the authentic taste if you make substitutions. If you can find them, use black salt in place of the rock salt, spherical puris in place of the wheat crackers, and plain sev in place of the crushed potato chips. ",https://imagesvc.meredithcorp.io/v3/mm/image?url=https%3A%2F%2Fimages.media-allrecipes.com%2Fuserphotos%2F1133714.jpg,4,379.3,9,5.0,64.0,5.5,23.2,9.5,3.0,0.0074,0.2742,0.0023,0.0777,1.0144,0.5156000000000001,"½ cup garbanzo beans #2 cups plain yogurt #1 teaspoon grated fresh ginger #½ teaspoon chili powder #¼ teaspoon ground cumin #¼ teaspoon ground coriander seed #¼ teaspoon rock salt #¼ teaspoon ground black pepper # salt to taste #1 large potato - peeled, boiled and mashed #32 thin wheat crackers #¼ cup green chutney #¼ cup sweet and sour chutney #½ cup red onion, minced #½ cup chopped fresh cilantro #½ cup crushed potato chips "
22,Green Chutney,14122,"Chutney is excellent served as a condiment with any number of dishes, it adds a flavor that can't be beat. ",https://imagesvc.meredithcorp.io/v3/mm/image?url=https%3A%2F%2Fpublic-assets-ucg.meredithcorp.io%2F22bad3d2340360580b728214b53c2bef%2F4569683.jpg,4,25.2,37,4.7,3.2,0.8,1.0,1.2,0.2,0.0,0.0147,0.0005,0.011699999999999999,0.1443,0.0077,1 bunch fresh cilantro #1 clove garlic #1 tablespoon minced fresh ginger root #1 minced hot green chile peppers #1 tablespoon peanuts # salt to taste #2 tablespoons lemon juice 
23,Sweet and Sour Chutney,14123,Indian chutney is excellent served with other Indian dishes or with simple rice and beans. Chutney is delicious! Tamarind extract can be bought a Indian grocery stores and in some supermarkets. ,0,4,38.3,4,4.9,9.8,0.7,8.6,0.1,0.0,0.0,0.0109,0.0005,0.0058,0.0683,0.002,"1 tablespoon tamarind extract #1 tablespoon brown sugar #¼ cup water #4 dates, pitted and chopped #1 teaspoon cumin seeds "
24,Al's Quick Vegetarian Spaghetti,14124,This is a quick meal to satisfy guests who do not eat meat. It will fill you up. Buy a chunky tomato sauce to make your sauce thicker. ,https://imagesvc.meredithcorp.io/v3/mm/image?url=https%3A%2F%2Fimages.media-allrecipes.com%2Fuserphotos%2F5462620.jpg,8,278.6,22,3.4,57.8,4.4,6.4,1.6,0.3,0.0,0.0325,0.003,0.0519,0.4957,0.468,"1 pound uncooked spaghetti #1 cup broccoli florets #1 (15 ounce) can whole kernel corn, drained #1 cup fresh sliced mushrooms #1 cup sliced carrots #2 (8 ounce) cans tomato sauce "
25,Quick Vegan Gravy,14125,"Delicious vegan gravy! This is great to make biscuits and gravy or for Thanksgiving over mashed potatoes. Pareve margarine is Kosher margarine, it can be bought at most grocery stores. ",https://imagesvc.meredithcorp.io/v3/mm/image?url=https%3A%2F%2Fimages.media-allrecipes.com%2Fuserphotos%2F9431433.jpg,8,46.8,22,4.2,6.2,0.7,1.5,1.8,0.3,0.0,0.011699999999999999,0.0005,0.0037,0.0175,0.4245,1 tablespoon pareve margarine #¼ cup all-purpose flour #3 cups vegetable broth #2 tablespoons miso paste #2 tablespoons warm water #2 teaspoons soy sauce #¼ teaspoon onion powder 
26,Country Fried Squash,14126,"This recipe was my Grandmother's and it actually won a Blue Ribbon in the Tennessee State Fair! Be sure to use fresh squash, I use butternut but other squash would also be good. ",https://imagesvc.meredithcorp.io/v3/mm/image?url=https%3A%2F%2Fimages.media-allrecipes.com%2Fuserphotos%2F2413141.jpg,4,501,128,4.4,105.0,15.2,16.6,8.7,1.7,0.0489,0.3737,0.0063,0.25980000000000003,2.5237,0.1454,"6 pounds butternut squash - peeled, seeded and sliced #1 egg, beaten #½ cup milk #½ cup all-purpose flour #½ cup cornmeal #1 pinch salt #1 pinch ground black pepper #1 pinch garlic salt #1 cup oil for frying "
27,Ricotta Stuffed Squash,14127,This yummy squash recipe is easy and healthy to make. Serve it warm with pasta or rice. ,https://imagesvc.meredithcorp.io/v3/mm/image?url=https%3A%2F%2Fimages.media-allrecipes.com%2Fuserphotos%2F48626.jpg,8,184.7,59,4.3,22.4,5.9,13.3,8.1,3.5,0.0587,0.1454,0.0025,0.0843,0.9742999999999999,0.6353,"8 yellow squash #2 tablespoons butter #1 onion, chopped #1 clove garlic, minced #1 (10 ounce) package frozen chopped spinach, thawed #2 eggs #2 cups ricotta cheese #¼ cup grated Parmesan cheese #1 tablespoon chopped fresh parsley #½ teaspoon salt #1 teaspoon Italian seasoning #1 pinch ground black pepper #1 (26 ounce) jar spaghetti sauce "
28,Herb Roasted Vegetables,14128,"This recipe works best when baked in a convection oven, it allows the herbs to fully flavor the dish. ",https://imagesvc.meredithcorp.io/v3/mm/image?url=https%3A%2F%2Fimages.media-allrecipes.com%2Fuserphotos%2F1450.jpg,7,170.9,21,4.0,23.4,4.6,3.4,8.0,1.1,0.0,0.0355,0.0014,0.0345,0.5982999999999999,0.0158,"1 ½ pounds new potatoes, quartered #½ cup baby carrots #1 small onion, cut into wedges #¼ cup olive oil #3 tablespoons lemon juice #3 cloves garlic, minced #1 tablespoon chopped fresh rosemary #1 tablespoon dried oregano # salt and pepper to taste #½ small eggplant, quartered and cut into 1/2-inch st #1 red bell pepper, cut into 1/2-inch wide strips "
29,Bruschetta II,14129,"This Italian appetizer made of bread, fresh spinach, and some other goodies is great for serving at parties. A French baguette is a long, narrow loaf of French bread. I like to garnish the bruschetta with more basil. ",https://imagesvc.meredithcorp.io/v3/mm/image?url=https%3A%2F%2Fimages.media-allrecipes.com%2Fuserphotos%2F5380507.jpg,8,528.7,47,4.8,30.2,8.7,4.5,39.7,4.4,0.0055,0.2513,0.0040999999999999995,0.1936,0.6015,0.2865,"1 (8 ounce) loaf French baguette #1 ½ cups spinach - packed, rinsed and torn #½ cup grated Parmesan cheese #3 cups finely chopped almonds #3 tablespoons chopped fresh basil #1 clove garlic, minced # salt to taste # freshly ground black pepper #3 tablespoons olive oil #1 cup chopped tomatoes #2 tablespoons thinly sliced green onion "
30,Jeera (Cumin) Rice,14130,"This is a wonderfully cumin flavored rice that enhances the flavor of many a dull meal!! Some variations to this recipe that are delicious: after adding the cumin seeds add onion, ginger, whole black peppercorn, cloves, or a cinnamon stick. You could also add all of the above options to make a rice chock-full of tastes! ",https://imagesvc.meredithcorp.io/v3/mm/image?url=https%3A%2F%2Fimages.media-allrecipes.com%2Fuserphotos%2F307084.jpg,2,464.9,26,4.1,77.0,1.1,0.0,13.9,1.8,0.0,0.004900000000000001,0.0011,0.0019,0.0094,0.0009,2 tablespoons vegetable oil #½ teaspoon cumin seeds #1 cup dry jasmine rice #1 ¾ cups water # salt to taste 
31,Vegetarian Link Gravy,14131,"Vegetarian sausage links can be bought at many supermarkets, experiment with the different brands and choose your favorite for this delicious gravy. If you would like a thicker gravy dissolve 1 tablespoon of cornstarch in 1 tablespoon warm water and mix into the gravy just before bringing it to a boil. ",https://imagesvc.meredithcorp.io/v3/mm/image?url=https%3A%2F%2Fpublic-assets-ucg.meredithcorp.io%2F4792d06e9efa7e011fa40ef72242b6ce%2F2828475.jpg,4,207.7,40,4.5,7.9,1.4,0.8,17.1,2.5,0.0,0.0304,0.0017,0.0146,0.0915,1.0297,6 links vegetarian sausage #3 tablespoons olive oil #1 cup vegetable broth #⅛ cup all-purpose flour #1 teaspoon salt # freshly ground black pepper #¼ teaspoon dried sage 
32,Black Bean and Salsa Soup,14132,This soup is one of those last minute things I tossed together one night. It's very simple and it takes about 5 minutes to put together. ,https://imagesvc.meredithcorp.io/v3/mm/image?url=https%3A%2F%2Fimages.media-allrecipes.com%2Fuserphotos%2F9351454.jpg,4,240.1,1482,4.7,34.5,12.9,3.2,5.0,1.9,0.0063,0.1133,0.0052,0.013800000000000002,0.2307,1.2161,"2 (15 ounce) cans black beans, drained and rinsed #1 ½ cups vegetable broth #1 cup chunky salsa #1 teaspoon ground cumin #4 tablespoons sour cream #2 tablespoons thinly sliced green onion "
33,Finnish Summer Soup,14133,"This soup should be made with fresh vegetables. Serve with a bread and cheese platter as they do in Finland. If you can't get fresh shelled green peas, use frozen tiny green peas. ",https://imagesvc.meredithcorp.io/v3/mm/image?url=https%3A%2F%2Fstatic.onecms.io%2Fwp-content%2Fuploads%2Fsites%2F43%2F2021%2F08%2F10%2F14133_FinnishSummerSoup-MFS_MFS-WD-3x2-1-2000.jpg,4,563.3,14,4.4,82.9,19.1,9.2,20.7,12.5,0.06,0.35810000000000003,0.0074,0.16319999999999998,2.0799000000000003,0.7496,"2 cups water #5 small potatoes, peeled and halved #1 teaspoon salt #⅛ teaspoon ground black pepper #2 tablespoons butter #6 cups green onions, cut into 3 inch lengths #12 baby carrots #1 ½ pounds fresh green beans, cut into 1-inch lengths #2 cups fresh shelled green peas #2 cups half-and-half #3 tablespoons all-purpose flour "
34,Basic Microwave Risotto,14134,"Microwave Risotto is great because of its forgiving nature; if you forget it for a half hour, nothing is lost. Also, it is a wonderful clean-out-the-fridge, use-your-imagination, I-just-bounced-five-checks recipe. It reheats well too. You can use margarine or olive oil in place of the butter, and you can use apple juice or white grape juice in place of the wine. ",https://imagesvc.meredithcorp.io/v3/mm/image?url=https%3A%2F%2Fimages.media-allrecipes.com%2Fuserphotos%2F3437373.jpg,4,367.8,209,4.5,51.8,1.5,2.8,10.6,6.6,0.028399999999999998,0.09129999999999999,0.0008,0.010199999999999999,0.0868,0.333,"3 tablespoons butter #1 clove garlic, minced #1 onion, chopped #1 ½ cups vegetable broth #1 cup uncooked Arborio rice #¾ cup white wine #¼ cup grated Parmesan cheese "
35,Blackberry Syrup,14135,"Syrup for use on pancakes. You can store the syrup in the refrigerator if you intend to use it quickly. To preserve for a longer time, sterilize the jars, pour into the canning jars to within 1/4 inch of lid, adjust lids and process in boiling water canner for 10 minutes. ",https://imagesvc.meredithcorp.io/v3/mm/image?url=https%3A%2F%2Fimages.media-allrecipes.com%2Fuserphotos%2F7187271.jpg,18,172.1,39,4.6,44.5,0.0,44.4,0.0,0.0,0.0,0.0005,0.0,0.0,0.0011,0.0,4 cups blackberry juice #4 cups white sugar #⅓ (2 ounce) package powdered pectin (Optional)
36,Jasmine Rice,14136,"This pilaf is made with jasmine rice, an aromatic rice popular in Thai cuisine. ",https://imagesvc.meredithcorp.io/v3/mm/image?url=https%3A%2F%2Fimages.media-allrecipes.com%2Fuserphotos%2F1117118.jpg,4,325.1,101,4.1,59.4,1.4,0.2,6.8,0.9,0.0,0.0038,0.0008,0.0035,0.0297,0.0008,2 tablespoons olive oil #2 tablespoons chopped onion #¼ cup green peas #1 bay leaf #1 ½ cups dry jasmine rice #3 cups water # salt to taste 
37,Fresh California Salsa,14137,"I just throw this together, but it is very popular and requested at potlucks. Serve with tortilla chips. ",https://imagesvc.meredithcorp.io/v3/mm/image?url=https%3A%2F%2Fimages.media-allrecipes.com%2Fuserphotos%2F262864.jpg,16,12.1,126,4.3,2.7,0.7,1.5,0.1,0.0,0.0,0.0083,0.0002,0.0064,0.1311,0.0035,"4 large tomatoes, diced #½ large onion, minced #3 cloves garlic, chopped #⅔ cup chopped fresh cilantro #1 jalapeno pepper, seeded and minced #2 tablespoons fresh lime juice # salt to taste "
38,Vegan Italian Vegetable Soup,14138,A vegan main dish soup that is hearty and tastes great with crusty bread. ,https://imagesvc.meredithcorp.io/v3/mm/image?url=https%3A%2F%2Fimages.media-allrecipes.com%2Fuserphotos%2F8675390.jpg,6,184.7,53,4.5,37.2,9.5,5.1,1.3,0.1,0.0,0.1138,0.0039,0.046,0.6701,0.6344,"2 (14.5 ounce) cans vegetable broth #1 (28 ounce) can peeled and crushed tomatoes #2 large carrots, coarsely chopped #½ cup frozen green beans #1 stalk celery, thickly sliced #⅓ cup frozen pearl onions #2 cloves garlic, minced #1 tablespoon dried parsley #¾ teaspoon dried basil #1 bay leaf #1 cube vegetable bouillon #½ cup macaroni #1 (15 ounce) can kidney beans, drained #3 small zucchinis, cubed "
39,Kinaja,14139,Serve this fruit smoothie in tall glasses with straws. ,https://imagesvc.meredithcorp.io/v3/mm/image?url=https%3A%2F%2Fpublic-assets-ucg.meredithcorp.io%2Feed26997b7e95c7eefc4e9e29045cf7a%2F749687.jpg,5,143.6,9,4.0,35.8,3.2,24.3,0.5,0.1,0.0,0.0223,0.0006,0.032600000000000004,0.4775,0.0056,"1 cup orange juice #2 kiwis, peeled and sliced #3 ripe bananas, sliced #3 pineapple rings #½ cup unsweetened pineapple juice #2 cups crushed ice "
