,name,id,description,picture,servings,calories,reviews,rating,carbohydrates,dietary fiber,sugars,fat,saturated fat,cholesterol,calcium,iron,magnesium,potassium,sodium,ingredients
88,Peanut Butter Pie IV,12189,"This pie is light and fluffy, and topped with chocolate syrup. ",https://imagesvc.meredithcorp.io/v3/mm/image?url=https%3A%2F%2Fimages.media-allrecipes.com%2Fuserphotos%2F7500504.jpg,8,590.7,15,4.4,57.4,2.0,45.1,36.1,15.0,0.0475,0.1799,0.0016,0.060700000000000004,0.4184,0.4325,"1 (8 ounce) package cream cheese #1 (14 ounce) can sweetened condensed milk #¾ cup peanut butter #3 tablespoons lemon juice #1 teaspoon vanilla extract #1 cup frozen whipped topping, thawed #1 (9 inch) prepared graham cracker crust #2 tablespoons chocolate syrup "
89,Easy Sweet Potato Pie,12190,This is my family's favorite around the holidays. The rum and butter give the pie a rich flavor. ,https://imagesvc.meredithcorp.io/v3/mm/image?url=https%3A%2F%2Fimages.media-allrecipes.com%2Fuserphotos%2F156751.jpg,8,325.9,59,4.6,34.2,2.6,16.8,17.6,7.8,0.0732,0.13419999999999999,0.0013,0.027899999999999998,0.3911,0.38039999999999996,2 cups cooked and mashed sweet potatoes #2 eggs #1 ¼ cups evaporated milk #⅜ cup white sugar #½ teaspoon salt #½ teaspoon ground cinnamon #½ teaspoon ground nutmeg #2 tablespoons rum #4 tablespoons melted butter #1 (9 inch) unbaked pie crust 
90,Dutch Apple Pie,12191,This pie is baked in a brown grocery sack. It is so delicious. ,https://imagesvc.meredithcorp.io/v3/mm/image?url=https%3A%2F%2Fimages.media-allrecipes.com%2Fuserphotos%2F9409183.jpg,8,407.3,137,4.5,59.6,3.7,38.8,19.1,9.2,0.0305,0.0156,0.0014,0.011,0.1797,0.2002,"5 large Granny Smith apples - peeled, cored and sliced #½ cup white sugar #2 tablespoons all-purpose flour #½ teaspoon ground cinnamon #2 tablespoons lemon juice #½ cup white sugar #½ cup all-purpose flour #½ cup butter #1 recipe pastry for a 9 inch single crust pie "
91,Gooseberry Pie I,12192,This is a good introduction to gooseberries for those who are unfamiliar with this fruit. ,https://imagesvc.meredithcorp.io/v3/mm/image?url=https%3A%2F%2Fimages.media-allrecipes.com%2Fuserphotos%2F6765927.jpg,1,2826,28,4.1,568.3,25.9,420.1,63.0,15.4,0.0024,0.1734,0.0067,0.0724,1.0646,2.1158,3 cups fresh gooseberries #2 cups white sugar #3 tablespoons quick-cooking tapioca #½ teaspoon salt #1 recipe pastry for a 9 inch double crust pie #2 tablespoons milk #1 ½ tablespoons white sugar 
92,Velvety Walnut Fudge Pie,12193,"This is a very easy, but rich-tasting pie. The walnuts rise to the top to form a crunchy topping over the creamy filling. Garnish each slice with a dollop of whipped cream if you like. ",https://imagesvc.meredithcorp.io/v3/mm/image?url=https%3A%2F%2Fimages.media-allrecipes.com%2Fuserphotos%2F5306594.jpg,8,431.4,8,4.6,55.7,2.9,24.1,22.6,5.9,0.030100000000000002,0.0888,0.0021000000000000003,0.0448,0.1974,0.2275,1 (3.5 ounce) package non-instant chocolate fudge pudding mix #¾ cup light corn syrup #1 egg #1 cup chopped walnuts #¾ cup evaporated milk #½ cup semisweet chocolate chips #1 recipe pastry for a 9 inch single crust pie 
93,Confetti Pies,12194,"This is a very easy pie to make, and it is wonderful for hot summer days. Use pineapple tidbits or chunks. ",https://imagesvc.meredithcorp.io/v3/mm/image?url=https%3A%2F%2Fimages.media-allrecipes.com%2Fuserphotos%2F9399257.jpg,16,305.5,10,3.8,44.7,0.9,35.7,13.1,5.9,0.0083,0.0792,0.001,0.0144,0.1462,0.2085,"1 (14 ounce) can sweetened condensed milk #½ cup lemon juice #1 (8 ounce) container frozen whipped topping, thawed #2 (11 ounce) cans mandarin oranges, drained #1 (8 ounce) can pineapple tidbits, drained #2 (9 inch) prepared graham cracker crusts "
94,Spinach and Cheese Pie,12195,"This is a versatile pie; add garlic, fennel, chard, and/or herbed feta for tasty variations. ",https://imagesvc.meredithcorp.io/v3/mm/image?url=https%3A%2F%2Fimages.media-allrecipes.com%2Fuserphotos%2F5337277.jpg,8,586,19,4.0,40.8,4.5,3.2,38.8,20.4,0.138,0.4684,0.0062,0.1232,0.9362999999999999,0.9254,"2 pounds spinach, washed and chopped #1 onion, chopped #½ pound fresh mushrooms, sliced #3 tablespoons vegetable oil #2 cups ricotta cheese #2 tablespoons dried basil #2 eggs #1 cup feta cheese #¾ cup butter, melted #1 (16 ounce) package phyllo dough "
95,Blueberry Pie,12196,Blueberry pie is the best when made with fresh-picked berries! It is a beautiful sight with a lattice top. ,https://imagesvc.meredithcorp.io/v3/mm/image?url=https%3A%2F%2Fpublic-assets.meredithcorp.io%2F60e702d0aab70edd26eb60a5e4834793%2F165171403216517140103987908210270527747427.jpg,8,365.9,1511,4.5,52.6,3.5,26.0,16.6,4.7,0.0038,0.0109,0.0015,0.0104,0.086,0.3177,"¾ cup white sugar #3 tablespoons cornstarch #½ teaspoon ground cinnamon #¼ teaspoon salt #4 cups fresh blueberries #1 (14.1 ounce) package double-crust pie pastry, thawed #1 tablespoon butter "
96,Spinach Pie I,12197,Great when you don't have a lot of time to make dinner. ,https://imagesvc.meredithcorp.io/v3/mm/image?url=https%3A%2F%2Fimages.media-allrecipes.com%2Fuserphotos%2F6319370.jpg,8,331.6,12,4.2,16.1,1.3,4.7,24.3,9.1,0.1015,0.205,0.0015,0.028399999999999998,0.2667,0.7189,"6 slices bacon #3 cups spinach, rinsed and chopped #3 eggs #2 teaspoons white sugar #1 teaspoon salt #½ teaspoon onion powder #⅛ teaspoon ground black pepper #½ cup minced onion #1 clove garlic, minced #1 cup shredded Monterey Jack cheese #2 cups scalded milk #1 recipe pastry for a 9 inch single crust pie "
97,Peaches 'n Cream Pie,12198,"A wonderfully, easy pie to make that is good warm or cold, and makes its own crust! ",https://imagesvc.meredithcorp.io/v3/mm/image?url=https%3A%2F%2Fimages.media-allrecipes.com%2Fuserphotos%2F21494.jpg,8,352.5,100,4.6,49.6,1.2,37.6,15.2,9.3,0.06670000000000001,0.0501,0.001,0.007,0.15080000000000002,0.2142,"¾ cup all-purpose flour #1 (3 ounce) package non-instant vanilla pudding mix #3 tablespoons butter #1 egg #½ cup milk #2 ½ cups canned sliced peaches, syrup reserved #1 (8 ounce) package cream cheese #½ cup white sugar #1 tablespoon white sugar #1 teaspoon ground cinnamon "
98,Oatmeal Pie I,12199,This pie is very much like a pecan pie without the nuts. ,https://imagesvc.meredithcorp.io/v3/mm/image?url=https%3A%2F%2Fimages.media-allrecipes.com%2Fuserphotos%2F972463.jpg,8,557.5,4,4.4,61.8,2.3,29.8,34.2,18.7,0.1075,0.026199999999999998,0.0014,0.0215,0.1051,0.43839999999999996,"2 eggs #¾ cup white sugar #1 cup butter, melted #¾ cup dark corn syrup #¾ cup quick cooking oats #1 teaspoon vanilla extract #¼ teaspoon salt #¾ cup flaked coconut #1 recipe pastry for a 9 inch single crust pie "
