,name,id,description,picture,servings,calories,reviews,rating,carbohydrates,dietary fiber,sugars,fat,saturated fat,cholesterol,calcium,iron,magnesium,potassium,sodium,ingredients
85,House Fried Rice,18294,"Loaded with shrimp, ham, chicken, and veggies, just like in your favorite Chinese restaurant. This 'House' Fried Rice is delicious and an excellent use of leftovers! Feel free to substitute ingredients, depending on what you have on hand. ",https://imagesvc.meredithcorp.io/v3/mm/image?url=https%3A%2F%2Fimages.media-allrecipes.com%2Fuserphotos%2F8949043.jpg,8,236.2,467,4.3,26.4,2.4,2.9,8.4,1.7,0.0589,0.0318,0.0022,0.030199999999999998,0.2722,0.6026,"1 ½ cups uncooked white rice #3 tablespoons sesame oil #1 small onion, chopped #1 clove garlic, chopped #1 cup small shrimp - peeled and deveined #½ cup diced ham #1 cup chopped cooked chicken breast #2 stalks celery, chopped #2 carrots - peeled and diced #1 green bell pepper, chopped #½ cup green peas #1 egg, beaten #¼ cup soy sauce "
86,Hungarian Stuffed Yellow Peppers,18295,Bursting with juicy beef and tender rice: the best stuffed peppers around. The addition of sour cream is part of the pleasure. ,https://imagesvc.meredithcorp.io/v3/mm/image?url=https%3A%2F%2Fimages.media-allrecipes.com%2Fuserphotos%2F5246568.jpg,9,340.9,30,4.3,26.2,2.4,8.4,16.2,6.8,0.0871,0.0605,0.0034,0.054299999999999994,0.8707999999999999,0.2948,"9 yellow bell peppers #½ cup uncooked white rice #2 pounds lean ground beef #1 egg #1 onion, chopped # salt and pepper to taste #2 (12 fluid ounce) cans tomato juice #½ cup sour cream #1 tablespoon all-purpose flour "
87,Indiana-Style Fried Cabbage,18296,Get a taste of Indiana with this cabbage recipe. It is especially great served with ham or pork. You can omit the mushrooms if you are not a mushroom fan! ,https://imagesvc.meredithcorp.io/v3/mm/image?url=https%3A%2F%2Fimages.media-allrecipes.com%2Fuserphotos%2F2249058.jpg,8,126,81,4.6,8.5,3.3,4.3,8.4,4.1,0.0217,0.0504,0.0008,0.0208,0.3113,0.343,"½ pound bacon, diced #3 tablespoons butter #1 small head cabbage, chopped #1 cup chopped celery #1 green bell pepper, chopped # salt and pepper to taste #1 (4.5 ounce) can mushrooms, with liquid #1 onion, chopped "
88,Tuna Cheese Whirl Casserole,18297,This is a different breed of tuna and cheese casserole. A stunning new style of hot dish that will turn the world upside down. ,https://imagesvc.meredithcorp.io/v3/mm/image?url=https%3A%2F%2Fimages.media-allrecipes.com%2Fuserphotos%2F47374.jpg,6,434.9,3,3.2,33.0,0.2,6.0,24.7,12.5,0.057,0.32439999999999997,0.0026,0.024399999999999998,0.3098,1.4627000000000001,"2 cups biscuit mix #1 ⅔ cups milk #1 (8 ounce) package sliced pimento cheese #1 tablespoon chopped pimento #1 tablespoon chopped onion #¼ cup chopped green bell pepper #2 tablespoons butter #1 (10.75 ounce) can condensed cream of mushroom soup #1 (5 ounce) can tuna, drained "
89,Spicy Sweet Potato Salad,18298,"It's important to use good mayonnaise in this recipe, and to let the cooked potatoes chill overnight before making the salad. Vary the seasoning amounts to suit your taste. ",https://imagesvc.meredithcorp.io/v3/mm/image?url=https%3A%2F%2Fimages.media-allrecipes.com%2Fuserphotos%2F769375.jpg,8,333.1,66,4.6,32.3,3.5,4.0,22.1,3.3,0.0104,0.0319,0.0011,0.0381,0.6143,0.7571,"2 sweet potatoes #1 pound red potatoes #1 pound Yukon Gold potatoes #1 large red onion #2 teaspoons salt #1 clove garlic, minced #1 jalapeno pepper, seeded and minced #¼ cup fresh lemon juice #1 cup mayonnaise #1 tablespoon curry powder #¼ cup chopped fresh parsley #¼ teaspoon freshly ground black pepper "
90,Messy Taco Salad,18299,"A wonderful picnic, potluck or 3-day dinner. Quick and easy and everyone seems to love it. Optional toppings include chopped tomatoes and olives. I love to have this heated a bit the next day or two!!! ",https://imagesvc.meredithcorp.io/v3/mm/image?url=https%3A%2F%2Fimages.media-allrecipes.com%2Fuserphotos%2F566298.jpg,8,903.9,22,4.1,60.2,6.3,14.4,61.1,20.2,0.11259999999999999,0.5308999999999999,0.0035,0.1038,0.38330000000000003,1.8194000000000001,"1 pound lean ground beef #1 pound shredded Cheddar cheese #1 (15 ounce) can ranch-style beans #1 head iceberg lettuce, shredded #1 ¼ ounces taco seasoning mix #16 ounces thousand island dressing #14 ½ ounces tortilla chips "
