,name,id,description,picture,servings,calories,reviews,rating,carbohydrates,dietary fiber,sugars,fat,saturated fat,cholesterol,calcium,iron,magnesium,potassium,sodium,ingredients
89,Greek Pasta Salad I,11689,This is a great make-ahead pasta salad! ,https://imagesvc.meredithcorp.io/v3/mm/image?url=https%3A%2F%2Fimages.media-allrecipes.com%2Fuserphotos%2F9395937.jpg,4,745.6,764,4.6,40.4,5.4,5.4,56.1,14.9,0.0697,0.21969999999999998,0.0048,0.055,0.6426000000000001,1.2787,"½ cup olive oil #½ cup red wine vinegar #1 ½ teaspoons garlic powder #1 ½ teaspoons dried basil #1 ½ teaspoons dried oregano #¾ teaspoon ground black pepper #¾ teaspoon white sugar #2 ½ cups cooked elbow macaroni #3 cups fresh sliced mushrooms #15 cherry tomatoes, halved #1 cup sliced red bell peppers #¾ cup crumbled feta cheese #½ cup chopped green onions #1 (4 ounce) can whole black olives #¾ cup sliced pepperoni sausage, cut into strips "
90,Thai Noodles,11690,A spicy Thai noodle dish with chicken and vegetables. ,https://imagesvc.meredithcorp.io/v3/mm/image?url=https%3A%2F%2Fimages.media-allrecipes.com%2Fuserphotos%2F5642780.jpg,4,570.8,88,4.4,65.4,5.4,5.3,18.5,3.6,0.0659,0.0845,0.0031,0.107,0.9376,0.3717,"½ pound dried rice noodles #1 pound skinless, boneless chicken breast halves #1 dash soy sauce #1 green bell pepper, sliced #1 red bell pepper, sliced #1 cucumber, coarsely chopped #1 carrot, grated #10 mushrooms, halved #1 onion, chopped #2 cloves garlic, minced #1 tablespoon minced fresh ginger root #1 ½ tablespoons red chile sauce #¾ cup peanut sauce #2 tablespoons oyster sauce #1 tablespoon sesame oil #1 tablespoon sesame seeds "
91,Tomato and Garlic Pasta,11691,"There is nothing nicer than the flavor of fresh tomatoes. You can use canned, but the trouble you take to prepare this dish is worth it. You prepare the sauce while the pasta is cooking, no long hours of waiting. Great if you want meatless pasta. ",https://imagesvc.meredithcorp.io/v3/mm/image?url=https%3A%2F%2Fimages.media-allrecipes.com%2Fuserphotos%2F837215.jpg,4,260.3,170,4.5,41.9,5.0,7.5,6.8,1.4,0.0044,0.0862,0.0023,0.0297,0.7095,0.2356,1 (8 ounce) package angel hair pasta #2 pounds tomatoes #4 cloves crushed garlic #1 tablespoon olive oil #1 tablespoon chopped fresh basil #1 tablespoon tomato paste # salt to taste # ground black pepper to taste #¼ cup grated Parmesan cheese 
92,Alla Checca,11692,A wonderful recipe for an uncooked sauce made with fresh garden tomatoes and you don't have to cook a thing except for the pasta! ,https://imagesvc.meredithcorp.io/v3/mm/image?url=https%3A%2F%2Fimages.media-allrecipes.com%2Fuserphotos%2F695957.jpg,4,609.7,207,4.6,69.4,6.4,4.1,30.7,4.6,0.0851,0.0751,0.0046,0.0742,0.5985,0.0767,"5 tomatoes, seeded and diced #4 cloves garlic, minced #½ cup chopped fresh basil #½ cup olive oil # salt to taste #2 tablespoons grated Parmesan cheese #1 pound pasta "
93,Puttanesca I,11693,"Named after the Italian ladies of the night, this sauce goes well with any type of spaghetti. ",https://imagesvc.meredithcorp.io/v3/mm/image?url=https%3A%2F%2Fimages.media-allrecipes.com%2Fuserphotos%2F7885417.jpg,4,489.9,308,4.6,38.7,4.1,3.4,34.0,4.7,0.0443,0.0437,0.003,0.0451,0.437,0.7277,"8 ounces pasta #½ cup olive oil #3 cloves garlic, minced #2 cups chopped tomatoes, pushed through a sieve #4 anchovy filets, rinsed and chopped #2 tablespoons tomato paste #3 tablespoons capers #20 Greek olives, pitted and coarsely chopped #½ teaspoon crushed red pepper flakes "
94,Ricotta Apple Lasagna,11694,"Pasta for dessert? You bet! Ricotta and Cheddar cheeses are the perfect complement to sweet, spicy apples. ",https://imagesvc.meredithcorp.io/v3/mm/image?url=https%3A%2F%2Fimages.media-allrecipes.com%2Fuserphotos%2F1119187.jpg,14,359.6,24,3.7,52.1,1.6,15.0,13.5,8.1,0.049100000000000005,0.2,0.0012,0.0213,0.1535,0.19319999999999998,"2 cups shredded Cheddar cheese #1 cup ricotta cheese #1 egg #¼ cup white sugar #1 teaspoon almond extract #2 (21 ounce) cans apple pie filling #8 lasagne noodles, cooked and drained #6 tablespoons all-purpose flour #6 tablespoons packed brown sugar #¼ cup quick cooking oats #½ teaspoon ground cinnamon #1 pinch ground nutmeg #3 tablespoons butter #1 cup sour cream #⅓ cup packed brown sugar "
95,Cavatelli and Broccoli,11695,This is quick meal to make. Serve with garlic bread. ,https://imagesvc.meredithcorp.io/v3/mm/image?url=https%3A%2F%2Fimages.media-allrecipes.com%2Fuserphotos%2F9066044.jpg,12,316.7,131,4.4,47.6,3.8,3.7,10.3,1.7,0.0007,0.0565,0.0025,0.047,0.326,0.2344,"3 heads fresh broccoli, cut into florets #½ cup olive oil #3 cloves garlic, minced #1 ½ pounds cavatelli pasta #1 teaspoon salt #1 teaspoon crushed red pepper flakes #2 tablespoons grated Parmesan cheese "
96,Mean Woman Pasta,11696,"A standard in our home, this one is simple to make and gets better with time. ",https://imagesvc.meredithcorp.io/v3/mm/image?url=https%3A%2F%2Fimages.media-allrecipes.com%2Fuserphotos%2F982753.jpg,4,610.8,51,4.5,92.8,6.3,7.4,20.5,3.0,0.0,0.0872,0.004900000000000001,0.0708,0.5552,1.7198,"1 pound seashell pasta #3 cups chopped tomatoes #5 cloves garlic, minced #15 each kalamata olives, pitted and sliced #¼ cup chopped fresh basil #¼ cup olive oil #10 each pepperoncini "
97,Tuna and Red Pepper Sauce,11697,All you have to cook is the pasta! ,https://imagesvc.meredithcorp.io/v3/mm/image?url=https%3A%2F%2Fimages.media-allrecipes.com%2Fuserphotos%2F8263019.jpg,8,292.6,15,4.0,43.3,2.2,2.7,8.4,1.3,0.0047,0.0214,0.0023,0.0325,0.15869999999999998,0.2819,"8 ounces roasted red bell peppers, diced #1 (5 ounce) can tuna, drained #¼ cup chopped parsley #¼ cup olive oil #2 teaspoons capers #2 teaspoons minced garlic #½ teaspoon salt #½ teaspoon ground black pepper #1 pound seashell pasta "
98,Goat Cheese and Arugula over Penne,11698,"This is a quick, easy, and elegant dish. Serve as a main course with a good loaf of bread, or as a side dish. ",https://imagesvc.meredithcorp.io/v3/mm/image?url=https%3A%2F%2Fimages.media-allrecipes.com%2Fuserphotos%2F6887691.jpg,6,316.7,227,4.6,29.7,1.7,2.1,17.8,6.8,0.0205,0.0997,0.0018,0.0315,0.19669999999999999,0.334,"5 ½ ounces goat cheese #2 cups coarsely chopped arugula, stems included #1 cup quartered cherry tomatoes #¼ cup olive oil #2 teaspoons minced garlic #½ teaspoon ground black pepper #½ teaspoon salt #8 ounces penne pasta "
99,Mussels Mariniere with Linguine,11699,A wonderful mussel sauce served over a bed of noodles. ,https://imagesvc.meredithcorp.io/v3/mm/image?url=https%3A%2F%2Fimages.media-allrecipes.com%2Fuserphotos%2F665084.jpg,4,772,43,4.3,94.4,4.5,9.2,13.6,6.3,0.1026,0.1653,0.037399999999999996,0.09290000000000001,1.1264,0.517,"4 quarts fresh mussels #1 (16 ounce) package linguini pasta #3 tablespoons butter #1 onion, chopped #2 cloves garlic, minced #6 tablespoons chopped fresh parsley #1 bay leaf #¼ teaspoon dried thyme #2 cups white wine "
